question,context
"Bạn là ai, bạn tên là gì, do công ty nào tạo ra hoặc phát triển?","Tôi là VNPT Money Chatbot được phát triển bởi Công ty phát triển phần mềm VNPT Media Software, trực thuộc tổng công ty Truyền thông VNPT Media - một thành viên của tập đoàn VNPT."
VNPT là gì?,"Tập đoàn Bưu chính Viễn thông Việt Nam (tên giao dịch quốc tế: Vietnam Posts and Telecommunications Group, viết tắt: VNPT) là một doanh nghiệp của nhà nước chuyên về đầu tư, sản xuất, kinh doanh trong lĩnh vực Viễn thông và Công nghệ thông tin tại Việt Nam."
Ngành nghề kinh doanh của VNPT là gì?,"Kinh doanh các sản phẩm, dịch vụ viễn thông, công nghệ thông tin, truyền thông đa phương tiện. Tư vấn, khảo sát, thiết kế, lắp đặt, khai thác, bảo dưỡng, sửa chữa, cho thuê công trình, thiết bị viễn thông, công nghệ thông tin. Nghiên cứu, phát triển, chế tạo, sản xuất, kinh doanh, xuất khẩu, nhập khẩu thiết bị, sản phẩm viễn thông, công nghệ thông tin, truyền thông đa phương tiện."
VNPT Media là gì?,"Tổng công ty Truyền thông (Tên viết tắt: VNPT Media) được thành lập theo Quyết định số 89/QĐ-VNPT-HĐTV -TCCB ngày 08 tháng 05 năm 2015 của Chủ tịch Tập đoàn Bưu chính Viễn thông Việt Nam, trên cơ sở tổ chức lại Công ty VASC, Trung tâm Thông tin và Quan hệ công chúng và các bộ phận nghiên cứu, phát triển nội dung số, dịch vụ giá trị gia tăng của Công ty VDC, Công ty Vinaphone."
Ngành nghề kinh doanh của VNPT Media là gì?,"Ngành nghề kinh doanh chính của VNPT Media gồm tổ chức nghiên cứu, phát triển, sản xuất các sản phẩm dịch vụ phần mềm, dịch vụ nội dung, giá trị gia tăng, truyền thông, truyền hình; quản lý và thực hiện hoạt động truyền hình, cung cấp chương trình thuê bao…"
Các công ty thành viên của VNPT Media là gì?,VNPT Media gồm các công ty thành viên: 1. Công ty Phát triển Dịch vụ Truyền hình (MyTV); 2. Công ty Phát triển Dịch vụ Giá trị gia tăng (VAS); 3. Công ty Phát triển Phần mềm VNPT Media (VNPT- Media Software); 4. Trung tâm Dịch vụ Tài chính số ( VNPT Fintech).
Công ty VNPT Media Software là gì?,"Công ty Phát triển Phần mềm VNPT Media (gọi tắt là Công ty VNPT Media Software) là đơn vị kinh tế trực thuộc Tổng công ty Truyền thông (VNPT-Media), được thành lập ngày 05/05/2016 theo Quyết định số 185/QĐ-VNPT-Media-NS ngày 05/05/2016 của Chủ tịch Tổng công ty Truyền thông trên cơ sở một bộ phận tách ra từ Công ty Phát triển dịch vụ Giá trị Gia tăng (Công ty VAS)."
Chức năng của công ty phát triển phần mềm VNPT Media Software là gì?,"Công ty VNPT Media Software có chức năng nghiên cứu và phát triển tất cả các platform dịch vụ mà VNPT-Media đang cung cấp hiện nay, giúp VNPT tiến tới tự chủ hoàn toàn trong lĩnh vực phần mềm. Xa hơn nữa trong tương lai, Công ty VNPT-Media Software sẽ tiếp tục phát triển các nền tảng lõi cho các dịch vụ sắp tới mà VNPT sẽ cung cấp và hướng tới có thể trở thành một sản phẩm thương mại, tiến ra thị trường nước ngoài."
VNPT VAS là gì?,"Công ty Phát triển Dịch vụ Giá trị gia tăng (Công ty VNPT VAS) được thành lập ngày 29/6/2015 theo quyết định số 86/QĐ-VNPT-MEDIA-NS ngày 29/06/2015 của Chủ tịch Tổng công ty Truyền thông. Nhiệm vụ của công ty phát triển dịch vụ giá trị gia tăng VNPT VAS là Tổ chức điều hành toàn bộ hoạt động trực tiếp sản xuất, cung cấp các sản phẩm dịch vụ giá trị gia tăng, dịch vụ nội dung của Tổng công ty Truyền thông (VNPT-Media) cho thị trường/khách hàng theo mục tiêu, kế hoạch kinh doanh, chiến lược phát triển của Tổng công ty Truyền thông, Tập đoàn Bưu chính Viễn thông Việt Nam (Tập đoàn VNPT) và phù hợp với pháp luật."
Công ty MyTV là gì?,"Công ty Phát triển Dịch vụ Truyền hình (Tên viết tắt: Công ty Truyền hình MyTV), tiền thân là Trung tâm IPTV – thuộc Công ty Phần mềm và Truyền thông VASC – Tập đoàn Bưu chính Viễn thông Việt Nam (Tập đoàn VNPT), được thành lập theo QĐ số 257/2000/QĐ – TCCB của Tổng cục Bưu điện. Theo quá trình tái cấu trúc Tập đoàn VNPT, Công ty Truyền hình MyTV hiện trực thuộc Tổng công ty Truyền thông – VNPT-Media, được thành lập theo Quyết định số: 88/QĐ-VNPT-MEDIA-NS ngày 29/06/2015."
Truyền hình MyTV là gì?,"Truyền hình MyTV là dịch vụ truyền hình đa phương tiện được cung cấp bởi Tập đoàn Bưu chính viễn thông Việt Nam, nhằm mang đến cho khách hàng những kho giải trí đa dạng, phong phú và trải nghiệm giải trí mới lạ, thú vị nhờ kết cấu màn hình bố trí chuẩn smart TV."
Vinaphone là gì?,"VinaPhone là đơn vị thành viên của Tập đoàn Bưu chính Viễn thông Việt Nam (VNPT), là đơn vị kinh doanh chủ lực và có vai trò quan trọng trong chuỗi giá trị của Tập đoàn VNPT. VNPT VinaPhone có mạng lưới kinh doanh trên 15.000 nhân viên kinh doanh và hơn 103.000 điểm kinh doanh trên khắp 63 tỉnh thành phố với 100.000 trạm BTS (2G/3G/4G/5G)."
VNPT Net là gì?,"Tổng Công ty Hạ tầng mạng (tên gọi tắt VNPT Net) là đơn vị thành viên hạch toán phụ thuộc của Tập đoàn Bưu chính Viễn thông Việt Nam. Được thành lập theo Quyết định số 86/QĐ-VNPT-HĐTV-TCCB ngày 08 tháng 5 năm 2015 của Hội đồng thành viên Tập đoàn Bưu chính Viễn thông Việt Nam trên cơ sở tổ chức lại Công ty Viễn thông Liên tỉnh (VTN), bộ phận quản lý và điều hành viễn thông của Tập đoàn, bộ phận hạ tầng của các đơn vị Công ty Dịch vụ Viễn thông (Vinaphone), Công ty Điện toán và Truyền số liệu (VDC), Công ty Viễn thông Quốc tế (VNPT-I), vệ tinh Vinasat 1, 2 và hạ tầng kỹ thuật của các Trung tâm Chuyển mạch Truyền dẫn thuộc 63 viễn thông tỉnh thành phố."
MyVNPT là ứng dụng gì?,"MyVNPT là ứng dụng trên di động cho phép người dùng là khách hàng của VNPT quản lý tất cả các thông tin tài khoản dịch vụ của VNPT trong cùng một nơi bao gồm: di động VinaPhone, điện thoại cố định, internet FiberVNN và truyền hình MyTV."
Nhiệm vụ của Công ty Phát triển Dịch vụ Truyền hình MyTV là gì?,"Công ty Truyền hình MyTV đang tập trung khai thác, phát triển mạng lưới truyền hình cũng như sản xuất các sản phẩm dịch vụ truyền hình, kinh doanh các dịch vụ nội dung, quảng cáo trên truyền hình…với thương hiệu truyền hình MyTV."
VNPT Fintech là gì?,"Trung tâm Dịch vụ tài chính số VNPT (gọi tắt là Trung tâm VNPT FinTech) là đơn vị kinh tế trực thuộc, hoạch toán phụ thuộc Tổng công ty Truyền thông (VNPT Media), được thành lập ngày 10/04/2019 theo Quyết định số 473/QĐ-VNPT Media-NS của Chủ tịch Tổng công ty Truyền thông trên cơ sở hoạt động dưới hình thức chi nhánh của Tổng công ty Truyền thông."
VNPT Fintech kinh doanh những lĩnh vực gì?,"Trung tâm VNPT FinTech có chức năng kinh doanh các dịch vụ Trung gian thanh toán; dịch vụ tư vấn, xây dựng giải pháp Trung gian thanh toán, dịch vụ công nghệ bảo hiểm phục vụ khách hàng cá nhân và doanh nghiệp, chính phủ; hoạt động mua bán, sát nhập đầu tư; kinh doanh các sản phẩm, dịch vụ liên quan tới dịch vụ công nghệ bảo hiểm, dịch vụ tài chính số khác (ngân hàng đại lý, chuyển tiền mặt…) theo định hướng chiến lược của Tổng công ty, Tập đoàn."
VNPT Money là gì?,"VNPT Money là giải pháp thanh toán không tiền mặt đơn giản, an toàn, tiện lợi với nhiều hình thức như qua Mobile Money, Ví điện tử, Tài khoản ngân hàng, đáp ứng mọi nhu cầu thanh toán hàng ngày và phù hợp cho mọi đối tượng khách hàng"
Mobile Money là gì ?,"Mobile Money là 1 loại tiền gắn với tài khoản di động của các thuê bao VinaPhone, cho phép khách hàng có thể nạp, rút, thanh toán, chuyển tiền ngay trên điện thoại di động."
Các lợi ích khi sử dụng Mobile Money?,"Các lợi ích khi sử dụng Mobile Money là: Miễn phí chuyển, nhận tiền đến/từ: Số thuê bao VinaPhone khác, Tài khoản Ví VNPT Money hoặc Mobile Money khác, Tài khoản/thẻ ngân hàng bất kỳ Nạp/Rút tiền mặt miễn phí tại hàng ngàn điểm giao dịch của VinaPhone tại khắp 63 tỉnh thành trên toàn quốc. Thanh toán vô vàn hoá đơn, dịch vụ (điện/nước, ...) với rất nhiều ưu đãi hàng tháng ngay trên ứng dụng VNPT Money. Thanh toán tại 160.000 điểm chấp nhận thanh toán VNPay QR, Payoo QR và VNPT Money QR trên toàn quốc."
Các dịch vụ trên VNPT Money?,"VNPT Money cung cấp các dịch vụ như: Dịch vụ viễn thông: Mua mã thẻ , Nạp tiền điện thoại , Thanh toán hóa đơn , Thanh toán cước di động trả sau. Dịch vụ truyền hình: Thanh toán hoá đơn KPLUS, Thanh toán hoá đơn VTVCAB Vận tải. Du lịch: Mua vé máy bay, Mua vé xe Thanh toán hóa đơn: Thanh toán tiền nước, Thanh toán tiền điện, Thanh toán hóa đơn tài chính. Dịch vụ giáo dục: Thanh toán học phí VnEdu, Thanh toán học phí SSC."
Các dịch vụ mà VNPT Money cung cấp cho khách hàng doanh nghiệp?,"VNPT Money cung cấp các dịch vụ sau cho khách hàng doanh nghiệp: Hỗ trợ thu hộ: Khách hàng hoặc đại lý của doanh nghiệp có thể dễ dàng thanh toán chi phí dịch vụ hoặc thông qua ứng dụng VNPT Money. Hỗ trợ chi hộ: Khách hàng, nhân viên hoặc đại lý của doanh nghiệp có thể nhận ngay được các khoản tiền nhỏ thông qua ứng dụng VNPT Money."
Cách mua mã thẻ di động trên ứng dụng VNPT Money?,Các bước mua mã thẻ di động bằng ví VNPT Money: -Bước 1: Chọn 'Nạp tiền điện thoại' trên màn hình chính -Bước 2: Nhập số thuê bao và chọn mệnh giá muốn nạp -Bước 3: Chọn hình thức thanh toán 'Ví VNPT Money'. Ấn 'Tiếp tục' -Bước 4: Nạp tiền thành công
Tôi muốn nạp tiền điện thoại bằng tài khoản ngân hàng trên VNPT Money thì làm thế nào?,Các bước nạp tiền điện thoại bằng tài khoản ngân hàng trên VNPT Money gồm các bước sau: -Bước 1: Chọn 'Nạp tiền điện thoại' trên màn hình chính. -Bước 2: Nhập số thuê bao và chọn mệnh giá muốn nạp. -Bước 3: Chọn hình thức thanh toán 'Tài khoản/Thẻ nội địa'. Ấn 'Tiếp tục'. -Bước 4: Chọn ngân hàng sử dụng. -Bước 5: Màn hình hiển thị thông tin tài khoản và tổng tiền. Ấn 'Tiếp tục'. -Bước 6: Điền thông tin tài khoản và hoàn tất giao dịch
Các tính năng nổi bật trên ứng dụng VNPT Money là gì ?,"Các tính năng nổi bật trên ứng dụng VNPT Money là: Nhận dạng hình ảnh thông minh khi thanh toán Miễn phí thanh toán mọi hoá đơn. Nạp/Rút tiền mặt bằng Mobile Money trực tiếp tại điểm giao dịch. Đa dạng hình thức thanh toán (Ví, Mobile Money, thẻ ngân hàng nội địa, thẻ quốc tế). Công nghệ và xác thực vân tay Auto Pay - Thanh toán tự động định kỳ."
Tài khoản Mobile Money khác gì với Tài khoản viễn thông?,"Đây là 2 tài khoản hoàn toàn khác nhau. Tài khoản Mobile Money là tài khoản tiền điện tử do nhà mạng đứng ra làm trung gian đảm bảo. Mobile Money có thể thanh toán tại hàng trăm nghìn điểm cung cấp dịch vụ trên toàn quốc, chuyển/nạp tiền bằng hình thức USSD hoặc bằng ứng dụng VNPT Money và rút tiền tại tất cả các điểm giao dịch của VinaPhone. Tài khoản viễn thông, mặt khác, chỉ được sử dụng để thanh toán các dịch vụ viễn thông của nhà mạng đó như: nghe, gọi, nhắn tin, truy cập internet..."
Tiền lưu trữ trong Tài khoản Mobile Money có giá trị tương đương như tiền mặt không?,Tiền lưu trữ trong Tài khoản Mobile Money có giá trị tương đương như tiền mặt. Số dư trong Tài khoản Mobile Money có giá trị giao dịch tương đương như tiền mặt.
Mobile Money có ứng dụng riêng không?,Khách hàng có thể sử dụng ứng dụng VNPT Money cho cả tài khoản Ví VNPT Money và Tài khoản Mobile Money.
Có thể chuyển tiền từ Mobile Money của nhà mạng này sang nhà mạng khác cung cấp được không?,"Rất tiếc, bạn không thể thực hiện chuyển tiền từ Mobile Money của nhà mạng này sang nhà mạng khác cung cấp."
Khi hủy tài khoản Mobile Money mà còn tiền trong tài khoản thì tiền có bị hủy không?,Khách hàng vui lòng đến điểm giao dịch tất toán tài khoản (rút hết tiền trong tài khoản) mới có thể hủy tài khoản Mobile Money.
Nếu cấp lại mật khẩu cho tài khoản Mobile Money thì mật khẩu tài khoản Ví VNPT Money có ảnh hưởng không?,Tài khoản Mobile Money và tài khoản Ví điện tử VNPT Money sử dụng chung 1 mật khẩu nên nếu thay đổi mật khẩu một trong hai tài khoản thì sẽ đổi cả mật khẩu tài khoản còn lại.
Làm sao để thanh toán dịch vụ bằng Mobile Money trên ứng dụng VNPT Money?,"Úng dụng VNPT Money hỗ trợ thanh toán tất cả các dịch vụ hiển thị trên ứng dụng, bao gồm: thanh toán hóa đơn điện, nước, học phí, cước viễn thông; mua vé tàu xe, bảo hiểm, mua sắm trực tuyến; thanh toán qua hình thức Quét Mã QR tại 160.000 điểm chấp nhận thanh toán và rất nhiều dịch vụ khác. Khách hàng lựa chọn dịch vụ trên ứng dụng và làm theo hướng dẫn, lưu ý lựa chọn nguồn tiền là Mobile Money khi xác nhận thông tin thanh toán. -Bước 1: Chọn dịch vụ cần thanh toán trên màn hình trang chủ hoặc trong menu dịch vụ. -Bước 2: Chọn sản phẩm, hóa đơn và nhập số tiền cần thanh toán. -Bước 3: Kiểm tra thông tin giao dịch. Bấm 'Thay đổi' để lựa chọn nguồn tiền mong muốn, sau đó bấm 'Thanh toán' để tiếp tục. ước 4: Nhập mã OTP -Bước 5: Thanh toán thành công."
Thanh toán hóa đơn tiền điện trên VNPT Money,"Để biết cách sử dụng VNPT Money thanh toán hóa đơn tiền điện, mời bạn theo dõi các -Bước dưới đây -Bước 1: Mở ứng dụng VNPT Money và đăng nhập tài khoản. -Bước 2 Vào mục Tiền điện. -Bước 3: Nhập mã khách hàng. -Bước 4: Kiểm tra thông tin tiền điện. -Bước 5: Chọn hình thức thanh toán. -Bước 6: Xác nhận thanh toán. -Bước 7: Thanh toán thành công."
Làm sao để thanh toán hóa đơn tiền điện tự động qua VNPT Money?,"Bên cạnh việc tự thực hiện thao tác thanh toán tiền điện mỗi kỳ như trên, bạn cũng có thể cài đặt dịch vụ thanh toán tự động tiền điện trên VNPT Money thông qua 2 cách dưới đây. Với dịch vụ này, bạn sẽ không phải mất thời gian thanh toán tiền điện mỗi tháng và không lo chẳng may thanh toán quá hạn nữa. Cách 1: -Bước 1 Xuất phát từ màn hình thanh toán tiền điện thành công, -Bước 2 Kiểm tra thông tin thanh toán tự động. Nếu thấy thông tin đã đúng, bạn nhấn nút Đăng ký , -Bước 3 Màn hình hiện thông báo Đăng ký thành công. Bạn chọn Đã hiểu để chuyển sang -Bước tiếp theo , -Bước 4 Thông tin hóa đơn tiền điện vừa đăng ký sẽ hiển thị ở danh mục quản lý Thanh toán tự động. Khách hàng có thể kiểm tra và theo dõi hóa đơn này. Cách 2: Xuất phát từ trang chủ ứng dụng VNPT Money: -Bước 1: Tại trang chủ của ứng dụng VNPT Money, chọn mục Dịch vụ khác để hệ thống chuyển sang trang mới. Sau khi chuyển sang trang mới, bạn chọn mục Thanh toán tự động. -Bước 2: Trong mục Thanh toán tự động, chọn Thêm hóa đơn mới. -Bước 3: Trong mục Thêm hóa đơn mới, chọn Tiền điện. -Bước 4: Nhập thông tin mã khách hàng vào ô và chọn Tiếp tục để chuyển sang thông tin đăng ký. -Bước 5: Kiểm tra thông tin hóa đơn vừa đăng ký và nhấn Đăng ký để xác nhận. -Bước 6: Màn hình hiển thị thông báo Đăng ký thành công, chọn Đã hiểu để chuyển sang -Bước tiếp theo. -Bước 7: Thông tin hóa đơn tiền điện vừa được đăng ký sẽ hiển thị ở mục Thanh toán tự động để khách hàng có thể kiểm tra và theo dõi."
Thanh toán tiền nước qua ứng dụng VNPT Money,"Để thanh toán tiền nước bằng ví VNPT Money khách hàng chỉ cần làm theo các -Bước đơn giản sau -Bước 1: Tại giao diện chính của ứng dụng, chọn Tiền nước; -Bước 2: Tìm đơn vị cung cấp nước; -Bước 3: Nhập Mã Khách Hàng. Mã khách hàng được ghi trong Giấy báo/Biên nhận tiền nước. Sau đó nhấn Tiếp tục để kiểm tra thông tin; -Bước 4: Kiểm tra thông tin thanh toán hóa đơn. Nhấn Tiếp tục để tiến hành thanh toán. Chọn hình thức thanh toán là Ví VNPT Money và nhấn Tiếp tục. Để cài đặt thanh toán tự động: -Bước 1: Chọn 'Cá nhân'. -Bước 2: chọn 'Thanh toán tự động'. -Bước 3 chọn 'Thêm hóa đơn mới'. -Bước 4 chọn 'Thanh toán tiền nước' và nhập mã khách hàng."
VNPT Money đã đạt những giải thưởng và chứng chỉ gì?,"Với những đóng góp cho việc thúc đẩy tài chính toàn diện tại Việt Nam, VNPT Money đã nhận được nhiều giải thưởng, chứng chỉ uy tín trong nước và quốc tế: Đạt chứng chỉ bảo mật quốc tế PCI DSS Giải Đồng giải thưởng Stevie Awards Châu Á - Thái Bình Dương 2021 Giải thưởng Sao Khuê 2021 trong lĩnh vực Chính phủ số Giải Vàng tại Giải thưởng Công nghệ thông tin Thế giới 2020 (IT World Awards) Giải Đồng tại Giải thưởng Stevie Awards Châu Á - Thái Bình Dương 2020 cho Xuất sắc đổi mới trong ngành Tài chính Giải thưởng Chuyển đổi số Việt Nam 2020 tại hạng mục Sản phẩm, dịch vụ, giải pháp công nghệ số tiêu biểu Giải thưởng Thành phố thông minh 2020 (Smart City Award Vietnam) tại hạng mục Giải pháp thanh toán thông minh Giải thưởng Top 10 Doanh nghiệp FinTech Việt Nam 2020."
Website của VNPT Money là gì?,Địa chỉ Website của VNPT Money là https://vnptmoney.vn
Giấy đăng ký kinh doanh (ĐKKD) và Giấy phép hoạt động của VNPT Money,Giấy đăng ký kinh doanh (ĐKKD) và Giấy phép hoạt động của VNPT Money số 0106873188 do Sở Kế hoạch và Đầu tư Thành phố Hà nội cấp ngày 12/06/2015. Giấy phép hoạt động: cung ứng dịch vụ TGTT số 41/GP/NHNN ngày 06/07/2017 do Thống đốc NHNN cấp
Địa chỉ trụ sở của VNPT Money?,"Địa chỉ trụ sở của VNPT Money là Số 57A, Phố Huỳnh Thúc Kháng, Phường Láng Hạ, Quận Đống Đa, TP. Hà Nội"
Cách Cài đặt Ứng Dụng VNPT Money?,Để Tải Ứng Dụng VNPT Money bạn hãy thực hiện như sau -Bước 1: Mở App Store (dành cho IOS) hoặc Google Play (dành cho Android). -Bước 2: Chọn 'Search' hoặc 'Tìm kiếm'. -Bước 3: Gõ 'VNPT Money' vào thanh tìm kiếm. -Bước 4: Ấn 'Get' hoặc 'Nhận' để tải.
Làm Thế Nào Để Tôi Có Thể Cập Nhật Phiên Bản Ứng Dụng VNPT Money Mới Nhất?,Để Cập Nhật Phiên Bản Ứng Dụng VNPT Money Mới Nhất bạn thực hiện như sau -Bước 1: Mở App Store (dành cho IOS) hoặc Google Play (dành cho Android). -Bước 2: Chọn 'Search' hoặc 'Tìm kiếm'. -Bước 3: Gõ 'VNPT Money' vào thanh tìm kiếm. -Bước 4: Ấn 'Cập nhật' hoặc 'Update'.
Các Bước thực hiện thanh toán phí vệ sinh môi trường qua VNPT Money,Các bước thực hiện thanh toán phí vệ sinh môi trường qua VNPT Money như sau -Bước 1: Chọn đơn vị vệ sinh môi trường và nhập mã khách hàng. -Bước 2: Kiểm tra thông tin kỳ cước và số tiền thanh toán. -Bước 3: Lựa chọn nguồn tiền và xác nhận thanh toán.
Các dịch vụ thanh toán qua VNPT Money,"Khi sử dụng ứng dụng VNPT Money để thanh toán, khách hàng sẽ nhận được nhiều lợi ích như: Có thể thanh toán nhiều dịch vụ khác nhau mà không cần dùng tiền mặt. Có thể thanh toán mọi lúc, mọi nơi và thanh toán ngay tại nhà mà không cần đi đâu xa nên tiết kiệm được thời gian, công sức. Được hưởng các khuyến mãi, ưu đãi tùy theo chương trình đang diễn ra tại thời điểm thanh toán. Với ứng dụng VNPT Money, bạn có thể dễ dàng thanh toán nhiều loại hình dịch vụ như: Dịch vụ vận tải, du lịch: Mua vé máy bay, vé xe rẻ, vé tàu; đặt phòng khách sạn; nạp tài khoản thu phí tự động VETC… Dịch vụ truyền hình: Thanh toán cước MyTV, MyTV Net, K+, VTVCab… Dịch vụ internet: Thanh toán cước internet cáp quang FiberVNN, mua gói Data 3G/4G… Dịch vụ viễn thông: Thanh toán cước VinaPhone trả sau, điện thoại cố định; nạp tiền điện thoại; mua mã thẻ cào VinaPhone, Mobifone, Vietnamobile… Dịch vụ giáo dục: Thanh toán học phí, tiền ăn… của nhiều trường học Dịch vụ điện, nước, vệ sinh môi trường Dịch vụ bảo hiểm Dịch vụ công, thủ tục hành chính Dịch vụ giải trí: Mua vé xem phim, vé sự kiện… Thanh toán hóa đơn VSMT Thanh toán hợp đồng tài chính Đóng góp từ thiện"
Thanh toán bằng cách quét mã QR trên VNPT Money,"Để Thanh toán bằng cách quét mã QR trên VNPT Money, hãy làm theo 6 -Bước sau -Bước 1: Vào kho ứng dụng, tải ứng dụng VNPT Money về máy điện thoại. -Bước 2: Mở ứng dụng VNPT Money ra. Trên trang chủ của ứng dụng, chọn vào mục có biểu tượng QR. -Bước 3: Cho phép ứng dụng VNPT Money chụp ảnh và quay video. Sau đó, quét mã QR trên hóa đơn cần thanh toán. -Bước 4: Các thông tin về dịch vụ và cước phí hiện ra. Bạn có thể kiểm tra lại các thông tin này và ấn Thanh toán. -Bước 5: Danh sách một loạt các ngân hàng hiện ra. Nhấn vào ngân hàng mà bạn muốn thanh toán. -Bước 6: Hệ thống tiến hành trừ tiền trong tài khoản ngân hàng và hiển thị thông báo thanh toán thành công."
Thanh toán bằng thẻ nội địa hoặc thẻ quốc tế trong ví VNPT Money,"Bạn không cần đăng ký tài khoản ví VNPT Money, bạn vẫn có thể tiến hành thanh toán bằng thẻ nội địa hoặc thẻ quốc tế trên ứng dụng này với 4 bước sau: -Bước 1: Đăng nhập ứng dụng VNPT Money và chọn dịch vụ cần thanh toán trên màn hình chính. -Bước 2: Nhập các thông tin được yêu cầu của dịch vụ để tra cước. -Bước 3: Kiểm tra thông tin thanh toán và chuyển sang -Bước tiếp theo. -Bước 4: Trong các hình thức thanh toán hiển thị, chọn thẻ nội địa/thẻ quốc tế và làm theo yêu cầu để tiến hành thanh toán. -Bước 5: Hệ thống thông báo thanh toán dịch vụ thành công."
Địa chỉ liên hệ của VNPT Money,"Địa chỉ liên hệ của VNPT Money như sau Trụ sở chính có Địa chỉ tại Số 57A Huỳnh Thúc Kháng, Láng Hạ, Đống Đa, Hà Nội. Văn phòng đại diện tại Miền Trung có Địa chỉ tại Số 4 Ông Ích Khiêm, Phường Thanh Bình, Quận Hải Châu, TP Đà Nẵng. Văn phòng đại diện tại Miền Nam có Địa chỉ tại Số 21-23 Hồ Văn Huê, Phường 9, Quận Phú Nhuận, TP. Hồ Chí Minh."
Số điện thoại liên hệ VNPT Money khi cần khiếu nại,Số điện thoại liên hệ VNPT Money khi cần khiếu nại là như sau Hotline: 18001091(nhánh 3)
Số điện thoại VNPT Money khi có thắc mắc,Số điện thoại VNPT Money khi có thắc mắc là như sau Hotline: 18001091(nhánh 3)
